{
  "formatVersion": 1,
  "id": "france-overview",
  "title": "An Introduction to France",
  "pages": [
    {
      "id": "geography",
      "heading": "France at a Glance",
      "subhead": "A country with many landscapes and a long history.",
      "blocks": [
        {
          "type": "text",
          "content": "France is in Western Europe. Its mainland includes Atlantic and Mediterranean coasts, broad plains, and the Alps and Pyrenees mountain ranges."
        },
        {
          "type": "list",
          "style": "unordered",
          "items": [
            "Capital: Paris",
            "Currency: euro",
            "Official language: French"
          ]
        }
      ]
    },
    {
      "id": "landmarks",
      "heading": "Places and Culture",
      "blocks": [
        {
          "type": "text",
          "content": "Paris is home to landmarks such as the Eiffel Tower and the Louvre. France also includes historic towns, agricultural regions, forests, and mountain communities."
        },
        {
          "type": "callout",
          "variant": "info",
          "content": "France has regions and territories beyond mainland Europe, so the country's geography is more varied than this short introduction can cover."
        }
      ]
    }
  ],
  "quiz": {
    "title": "France Basics",
    "passPercent": 70,
    "questions": [
      {
        "id": "capital",
        "type": "multiple-choice",
        "prompt": "What is the capital of France?",
        "options": [
          { "id": "paris", "text": "Paris" },
          { "id": "lyon", "text": "Lyon" },
          { "id": "nice", "text": "Nice" }
        ],
        "answer": "paris"
      },
      {
        "id": "euro",
        "type": "true-false",
        "prompt": "France uses the euro as its currency.",
        "answer": true
      }
    ]
  }
}